{
  "name": "default",
  "description": "Complete upstream engineering capability set.",
  "skills": [
    "api-and-interface-design",
    "browser-testing-with-devtools",
    "ci-cd-and-automation",
    "code-review-and-quality",
    "code-simplification",
    "constraint-driven-development",
    "context-engineering",
    "debugging-and-error-recovery",
    "deprecation-and-migration",
    "documentation-and-adrs",
    "doubt-driven-development",
    "frontend-ui-engineering",
    "git-workflow-and-versioning",
    "idea-refine",
    "incremental-implementation",
    "interview-me",
    "observability-and-instrumentation",
    "performance-optimization",
    "planning-and-task-breakdown",
    "security-and-hardening",
    "shipping-and-launch",
    "source-driven-development",
    "spec-driven-development",
    "test-driven-development",
    "using-agent-skills"
  ],
  "commands": ["spec", "plan", "build", "test", "constraints", "review", "webperf", "code-simplify", "ship"],
  "agents": ["code-reviewer", "security-auditor", "test-engineer", "web-performance-auditor"],
  "references": ["accessibility-checklist", "definition-of-done", "observability-checklist", "orchestration-patterns", "performance-checklist", "security-checklist", "testing-patterns"],
  "evals": ["routing-evals", "behavioral-evals"],
  "mcp": []
}
